{
  "schemaVersion": "db-source-id-snapshot-v1",
  "capturedAt": "2026-07-23T00:00:00.000Z",
  "provenance": "bootstrap_from_checked_in_csv:data/notice-sources.csv",
  "parityStatus": "unverified_without_db_read",
  "sourceIds": [
    "cau_001",
    "cau_002",
    "cau_003",
    "cau_004",
    "cau_006",
    "cau_007",
    "cau_008",
    "cau_009",
    "cau_010",
    "cau_011",
    "cau_013",
    "cau_016",
    "cau_017",
    "cau_018",
    "cau_019",
    "cau_020",
    "cau_021",
    "cau_022",
    "cau_023",
    "cau_024",
    "cau_025",
    "cau_026",
    "cau_027",
    "cau_028",
    "cau_030",
    "cau_031",
    "cau_032",
    "cau_033",
    "cau_034",
    "cau_035",
    "cau_036",
    "cau_037",
    "cau_038",
    "cau_040",
    "cau_041",
    "cau_042",
    "cau_064",
    "cau_065",
    "cau_066",
    "cau_067",
    "cau_068",
    "cau_069",
    "cau_070",
    "cau_071",
    "cau_072",
    "cau_073",
    "cau_074",
    "cau_075",
    "cau_076",
    "cau_077",
    "cau_078",
    "cau_079",
    "cau_080",
    "cau_081",
    "cau_082",
    "cau_083",
    "cau_univ_001",
    "ewha_003",
    "ewha_004",
    "ewha_005",
    "ewha_006",
    "ewha_007",
    "ewha_008",
    "ewha_009",
    "ewha_010",
    "ewha_011",
    "ewha_012",
    "ewha_013",
    "ewha_014",
    "ewha_015",
    "ewha_016",
    "ewha_017",
    "ewha_018",
    "ewha_019",
    "ewha_020",
    "ewha_021",
    "ewha_022",
    "ewha_023",
    "ewha_024",
    "ewha_025",
    "ewha_026",
    "ewha_027",
    "ewha_028",
    "ewha_029",
    "ewha_030",
    "ewha_031",
    "ewha_032",
    "ewha_033",
    "ewha_034",
    "ewha_035",
    "ewha_036",
    "ewha_037",
    "ewha_038",
    "ewha_040",
    "ewha_041",
    "ewha_042",
    "ewha_043",
    "ewha_044",
    "ewha_045",
    "ewha_046",
    "ewha_047",
    "ewha_048",
    "ewha_049",
    "ewha_050",
    "ewha_051",
    "ewha_052",
    "ewha_053",
    "ewha_054",
    "ewha_055",
    "ewha_056",
    "ewha_057",
    "ewha_058",
    "ewha_059",
    "ewha_060",
    "ewha_061",
    "ewha_062",
    "ewha_063",
    "ewha_064",
    "ewha_065",
    "ewha_066",
    "ewha_067",
    "ewha_068",
    "hanyang_005",
    "hanyang_006",
    "hanyang_007",
    "hanyang_008",
    "hanyang_009",
    "hanyang_010",
    "hanyang_011",
    "hanyang_012",
    "hanyang_013",
    "hanyang_014",
    "hanyang_015",
    "hanyang_016",
    "hanyang_017",
    "hanyang_018",
    "hanyang_019",
    "hanyang_020",
    "hanyang_021",
    "hanyang_022",
    "hanyang_023",
    "hanyang_024",
    "hanyang_025",
    "hanyang_033",
    "hanyang_034",
    "hanyang_035",
    "hanyang_036",
    "hanyang_038",
    "hanyang_039",
    "hanyang_040",
    "hanyang_041",
    "hanyang_061",
    "hanyang_062",
    "hanyang_063",
    "hanyang_064",
    "hanyang_065",
    "hanyang_066",
    "hanyang_068",
    "hanyang_069",
    "hanyang_070",
    "hanyang_071",
    "hanyang_072",
    "hanyang_073",
    "hanyang_074",
    "hanyang_075",
    "hanyang_076",
    "hanyang_077",
    "hanyang_078",
    "hanyang_079",
    "hanyang_080",
    "hanyang_081",
    "hanyang_082",
    "hanyang_083",
    "hanyang_084",
    "hongik_005",
    "hongik_006",
    "hongik_007",
    "hongik_008",
    "hongik_009",
    "hongik_010",
    "hongik_011",
    "hongik_013",
    "hongik_016",
    "hongik_017",
    "hongik_018",
    "hongik_019",
    "hongik_020",
    "hongik_022",
    "hongik_024",
    "hongik_025",
    "hongik_026",
    "hongik_027",
    "hongik_029",
    "hongik_030",
    "hongik_031",
    "hongik_033",
    "hongik_034",
    "hongik_035",
    "hongik_036",
    "hongik_037",
    "hongik_038",
    "hongik_041",
    "hongik_042",
    "hongik_043",
    "hongik_044",
    "hongik_045",
    "hongik_046",
    "hongik_047",
    "hongik_048",
    "hongik_049",
    "hongik_050",
    "khu_005",
    "khu_006",
    "khu_007",
    "khu_008",
    "khu_009",
    "khu_010",
    "khu_011",
    "khu_012",
    "khu_013",
    "khu_018",
    "khu_019",
    "khu_020",
    "khu_021",
    "khu_022",
    "khu_026",
    "khu_027",
    "khu_029",
    "khu_030",
    "khu_031",
    "khu_033",
    "khu_034",
    "khu_035",
    "khu_036",
    "khu_037",
    "khu_038",
    "khu_042",
    "khu_043",
    "khu_044",
    "khu_050",
    "khu_051",
    "khu_052",
    "khu_053",
    "khu_054",
    "khu_055",
    "khu_056",
    "khu_062",
    "khu_063",
    "khu_064",
    "khu_065",
    "khu_068",
    "khu_069",
    "khu_070",
    "khu_071",
    "khu_072",
    "khu_073",
    "khu_076",
    "khu_077",
    "khu_078",
    "khu_079",
    "khu_080",
    "khu_081",
    "khu_082",
    "khu_083",
    "khu_084",
    "khu_107",
    "khu_108",
    "khu_109",
    "khu_110",
    "khu_111",
    "khu_112",
    "khu_113",
    "khu_114",
    "khu_115",
    "khu_116",
    "khu_117",
    "khu_118",
    "khu_119",
    "khu_120",
    "khu_121",
    "khu_122",
    "khu_123",
    "khu_124",
    "khu_125",
    "khu_126",
    "khu_127",
    "khu_128",
    "khu_129",
    "khu_130",
    "khu_131",
    "khu_132",
    "korea_001",
    "korea_002",
    "korea_003",
    "korea_004",
    "korea_005",
    "korea_006",
    "korea_007",
    "korea_008",
    "korea_009",
    "korea_010",
    "korea_011",
    "korea_012",
    "korea_013",
    "korea_014",
    "korea_015",
    "korea_016",
    "korea_017",
    "korea_018",
    "korea_020",
    "korea_021",
    "korea_022",
    "korea_023",
    "korea_024",
    "korea_025",
    "korea_026",
    "korea_027",
    "korea_028",
    "korea_029",
    "korea_030",
    "korea_031",
    "korea_032",
    "korea_033",
    "korea_034",
    "korea_035",
    "korea_036",
    "korea_037",
    "korea_039",
    "korea_040",
    "korea_041",
    "korea_042",
    "korea_043",
    "korea_044",
    "korea_045",
    "korea_046",
    "korea_047",
    "korea_048",
    "korea_049",
    "korea_050",
    "korea_051",
    "korea_052",
    "korea_053",
    "korea_054",
    "korea_055",
    "korea_056",
    "korea_057",
    "korea_058",
    "korea_059",
    "korea_060",
    "korea_062",
    "korea_063",
    "korea_064",
    "korea_067",
    "korea_068",
    "korea_069",
    "korea_070",
    "korea_071",
    "korea_072",
    "korea_073",
    "korea_074",
    "korea_075",
    "korea_076",
    "skku_002",
    "skku_004",
    "skku_005",
    "skku_006",
    "skku_007",
    "skku_008",
    "skku_009",
    "skku_010",
    "skku_011",
    "skku_012",
    "skku_013",
    "skku_014",
    "skku_015",
    "skku_016",
    "skku_017",
    "skku_018",
    "skku_019",
    "skku_020",
    "skku_021",
    "skku_022",
    "skku_023",
    "skku_024",
    "skku_025",
    "skku_026",
    "skku_027",
    "skku_028",
    "skku_029",
    "skku_030",
    "skku_031",
    "skku_032",
    "skku_033",
    "skku_034",
    "skku_035",
    "skku_036",
    "skku_037",
    "skku_038",
    "skku_039",
    "skku_040",
    "skku_041",
    "skku_042",
    "skku_043",
    "skku_044",
    "skku_045",
    "skku_046",
    "skku_049",
    "skku_050",
    "skku_052",
    "skku_053",
    "skku_054",
    "skku_058",
    "skku_059",
    "skku_060",
    "skku_061",
    "skku_062",
    "skku_063",
    "skku_064",
    "skku_065",
    "skku_068",
    "skku_069",
    "skku_070",
    "skku_071",
    "skku_072",
    "skku_073",
    "skku_074",
    "skku_075",
    "skku_076",
    "skku_077",
    "skku_078",
    "skku_079",
    "skku_080",
    "skku_081",
    "skku_082",
    "skku_083",
    "skku_084",
    "skku_085",
    "skku_086",
    "uos_001",
    "uos_002",
    "uos_003",
    "uos_004",
    "uos_005",
    "uos_006",
    "uos_007",
    "uos_008",
    "uos_009",
    "uos_010",
    "uos_011",
    "uos_012",
    "uos_013",
    "uos_014",
    "uos_015",
    "uos_016",
    "uos_017",
    "uos_018",
    "uos_019",
    "uos_020",
    "uos_021",
    "uos_023",
    "uos_024",
    "uos_025",
    "uos_026",
    "uos_027",
    "uos_028",
    "uos_029",
    "uos_030",
    "uos_031",
    "uos_033",
    "uos_034",
    "uos_035",
    "uos_036",
    "uos_037",
    "uos_038",
    "uos_039",
    "uos_040",
    "uos_042",
    "uos_043",
    "uos_044",
    "uos_045",
    "uos_046",
    "uos_047",
    "uos_048",
    "uos_049",
    "uos_050",
    "uos_051",
    "yonsei_001",
    "yonsei_002",
    "yonsei_003",
    "yonsei_004",
    "yonsei_005",
    "yonsei_006",
    "yonsei_007",
    "yonsei_008",
    "yonsei_009",
    "yonsei_010",
    "yonsei_011",
    "yonsei_012",
    "yonsei_013",
    "yonsei_014",
    "yonsei_015",
    "yonsei_016",
    "yonsei_017",
    "yonsei_018",
    "yonsei_019",
    "yonsei_020",
    "yonsei_021",
    "yonsei_022",
    "yonsei_023",
    "yonsei_024",
    "yonsei_025",
    "yonsei_026",
    "yonsei_027",
    "yonsei_028",
    "yonsei_029",
    "yonsei_030",
    "yonsei_031",
    "yonsei_032",
    "yonsei_033",
    "yonsei_034",
    "yonsei_035",
    "yonsei_036",
    "yonsei_037",
    "yonsei_038",
    "yonsei_039",
    "yonsei_040",
    "yonsei_042",
    "yonsei_043",
    "yonsei_046",
    "yonsei_051",
    "yonsei_056",
    "yonsei_057",
    "yonsei_058",
    "yonsei_059",
    "yonsei_060",
    "yonsei_064",
    "yonsei_065",
    "yonsei_066",
    "yonsei_067",
    "yonsei_068",
    "yonsei_069",
    "yonsei_070",
    "yonsei_071",
    "yonsei_072",
    "yonsei_073"
  ],
  "sourceIdSetSha256": "615cb4e672021585217d01a3905492c8ee6b5271448458e3bdb92018bc35db49"
}
